[
  {
    "ticker": "AAPL",
    "strategy": "vcp",
    "as_of_date": "2026-03-27T00:00:00Z",
    "score": 0.78,
    "tags": ["vcp-pullback"]
  },
  {
    "ticker": "AAPL",
    "strategy": "vcp",
    "as_of_date": "2026-03-28T00:00:00Z",
    "score": 0.82,
    "tags": ["vcp-breakout", "volume-confirmed"]
  }
]
